post_id,parent_id,comment_id,text,category,clean_tokens
3259,null,null,Adjusting for covariates in ROC curve analysis,title,"[""adjusting"",""covariates"",""roc"",""curve"",""analysis""]"
3260,null,null,Combining many datasets to increase confidence,title,"[""combining"",""many"",""datasets"",""increase"",""confidence""]"
3261,null,null,Using Covariance Estimator to Perform Linear Regression?,title,"[""using"",""covariance"",""estimator"",""perform"",""linear"",""regression"",""?""]"
3270,null,null,Interpreting 2D correspondence analysis plots,title,"[""interpreting"",""2d"",""correspondence"",""analysis"",""plots""]"
3276,null,null,Regularization and Mean Estimation,title,"[""regularization"",""mean"",""estimation""]"
3286,null,null,Distance between empirically generated distributions (in R),title,"[""distance"",""empirically"",""generated"",""distributions"",""("",""r"","")""]"
3289,null,null,A matching problem for 3 decks of cards,title,"[""matching"",""problem"",""3"",""decks"",""cards""]"
3294,null,null,Resources for learning Markov chain and hidden Markov models,title,"[""resources"",""learning"",""markov"",""chain"",""hidden"",""markov"",""models""]"
3296,null,null,"""Dealing with """"trouble maker"""" samples""",title,"[""``"",""dealing"",""``"",""''"",""trouble"",""maker"",""''"",""''"",""samples"",""''""]"
3307,null,null,Fractal alternative to correlation,title,"[""fractal"",""alternative"",""correlation""]"
3324,null,null,Why use a lagged DV as an instrumental variable?,title,"[""use"",""lagged"",""dv"",""instrumental"",""variable"",""?""]"
3328,null,null,"Given a 10D MCMC chain, how can I determine its posterior mode(s) in R?",title,"[""given"",""10d"",""mcmc"",""chain"","","",""determine"",""posterior"",""mode"",""("","")"",""r"",""?""]"
3331,null,null,Is it possible to do time-series clustering based on curve shape?,title,"[""possible"",""time-series"",""clustering"",""based"",""curve"",""shape"",""?""]"
3342,null,null,Recreating R's hist function's bin counting,title,"[""recreating"",""r"",""'s"",""hist"",""function"",""'s"",""bin"",""counting""]"
3359,null,null,Product of beta distributions,title,"[""product"",""beta"",""distributions""]"
3362,null,null,Can I use Synthetic Control Method for Comparative Case Studies with survey data?,title,"[""use"",""synthetic"",""control"",""method"",""comparative"",""case"",""studies"",""survey"",""data"",""?""]"
3368,null,null,Does averaging across multiple time series render higher Nyquist frequency?,title,"[""averaging"",""across"",""multiple"",""time"",""series"",""render"",""higher"",""nyquist"",""frequency"",""?""]"
3372,null,null,Is it possible to accumulate a set of statistics that describes a large number of samples such that I can then produce a boxplot?,title,"[""possible"",""accumulate"",""set"",""statistics"",""describes"",""large"",""number"",""samples"",""produce"",""boxplot"",""?""]"
3381,null,null,"How to smooth histograms with bins 1, 2, 4, ... wide?",title,"[""smooth"",""histograms"",""bins"",""1"","","",""2"","","",""4"","","",""..."",""wide"",""?""]"
3383,null,null,Compare treatments on mean difference between two times,title,"[""compare"",""treatments"",""mean"",""difference"",""two"",""times""]"
3386,null,null,How to deal with non-binary categorical variables in logistic regression (SPSS),title,"[""deal"",""non-binary"",""categorical"",""variables"",""logistic"",""regression"",""("",""spss"","")""]"
3392,null,null,Excel as a statistics workbench,title,"[""excel"",""statistics"",""workbench""]"
3395,null,null,Smoothness of a surface,title,"[""smoothness"",""surface""]"
3402,null,null,What's the accuracy of data obtained through a random sample?,title,"[""'s"",""accuracy"",""data"",""obtained"",""random"",""sample"",""?""]"
3412,null,null,Comparing mixed effect models with the same number of degrees of freedom,title,"[""comparing"",""mixed"",""effect"",""models"",""number"",""degrees"",""freedom""]"
3413,null,null,Hurst exponent calculation methodology,title,"[""hurst"",""exponent"",""calculation"",""methodology""]"
3425,null,null,How to quasi match two vectors of strings (in R)?,title,"[""quasi"",""match"",""two"",""vectors"",""strings"",""("",""r"","")"",""?""]"
3438,null,null,Calculating percentile of normal distribution,title,"[""calculating"",""percentile"",""normal"",""distribution""]"
3445,null,null,How to calculate the pairwise LD for the given data?,title,"[""calculate"",""pairwise"",""ld"",""given"",""data"",""?""]"
3446,null,null,Is single precision floating point so bad?,title,"[""single"",""precision"",""floating"",""point"",""bad"",""?""]"
3458,null,null,"Alternatives to classification trees, with better predictive (e.g: CV) performance?",title,"[""alternatives"",""classification"",""trees"","","",""better"",""predictive"",""("",""e.g"","":"",""cv"","")"",""performance"",""?""]"
3463,null,null,Computing correlation (and the significance of said correlation) between a pair of time series,title,"[""computing"",""correlation"",""("",""significance"",""said"",""correlation"","")"",""pair"",""time"",""series""]"
3466,null,null,Best practice when analysing pre-post treatment-control designs,title,"[""best"",""practice"",""analysing"",""pre-post"",""treatment-control"",""designs""]"
3474,null,null,"Finding marginal densities of $f (x,y) = c \sqrt{1 - x^2 - y^2}, x^2 + y^2 \leq 1$",title,"[""finding"",""marginal"",""densities"",""$"",""f"",""("",""x"","","","")"",""="",""c"",""\\sqrt"",""{"",""1"",""-"",""x^2"",""-"",""y^2"",""}"","","",""x^2"",""+"",""y^2"",""\\leq"",""1"",""$""]"
3479,null,null,Cluster Analysis followed by Discriminant Analysis,title,"[""cluster"",""analysis"",""followed"",""discriminant"",""analysis""]"
3496,null,null,Why break down the denominator in Bayes' Theorem?,title,"[""break"",""denominator"",""bayes"",""'"",""theorem"",""?""]"
3497,null,null,Doing regressions on samples from a very large file: are the means and SEs of the sample coefficients consistent estimators?,title,"[""regressions"",""samples"",""large"",""file"","":"",""means"",""ses"",""sample"",""coefficients"",""consistent"",""estimators"",""?""]"
3504,null,null,"If an ANOVA indicates no main effect and no interaction, should the lack of interaction be stated?",title,"[""anova"",""indicates"",""main"",""effect"",""interaction"","","",""lack"",""interaction"",""stated"",""?""]"
3511,null,null,How to Apply the Iteratively Reweighted Least Squares (IRLS) Method to the LASSO Model?,title,"[""apply"",""iteratively"",""reweighted"",""least"",""squares"",""("",""irls"","")"",""method"",""lasso"",""model"",""?""]"
3514,null,null,What is the normality test for binary data?,title,"[""normality"",""test"",""binary"",""data"",""?""]"
3519,null,null,Is Matlab/octave or R better suited for monte carlo simulation?,title,"[""matlab/octave"",""r"",""better"",""suited"",""monte"",""carlo"",""simulation"",""?""]"
3526,null,null,Has anyone used the Marascuilo procedure for comparing multiple proportions?,title,"[""anyone"",""used"",""marascuilo"",""procedure"",""comparing"",""multiple"",""proportions"",""?""]"
3537,null,null,Unbalanced repeated measure design for the given data?,title,"[""unbalanced"",""repeated"",""measure"",""design"",""given"",""data"",""?""]"
3542,null,null,What is a good resource on table design?,title,"[""good"",""resource"",""table"",""design"",""?""]"
3549,null,null,Why is it possible to get significant F statistic (p<.001) but non-significant regressor t-tests?,title,"[""possible"",""get"",""significant"",""f"",""statistic"",""("",""p"",""<"","".001"","")"",""non-significant"",""regressor"",""t-tests"",""?""]"
3556,null,null,Adaptive kernel density estimators?,title,"[""adaptive"",""kernel"",""density"",""estimators"",""?""]"
3559,null,null,Which pseudo-$R^2$ measure is the one to report for logistic regression (Cox & Snell or Nagelkerke)?,title,"[""pseudo-"",""$"",""r^2"",""$"",""measure"",""one"",""report"",""logistic"",""regression"",""("",""cox"",""&"",""snell"",""nagelkerke"","")"",""?""]"
3561,null,null,Dealing with correlated regressors,title,"[""dealing"",""correlated"",""regressors""]"
3564,null,null,How to use Kernel Density Estimation for Prediction?,title,"[""use"",""kernel"",""density"",""estimation"",""prediction"",""?""]"
3586,null,null,Inconsistency between Chi-sq and CI Estimation using Wald test,title,"[""inconsistency"",""chi-sq"",""ci"",""estimation"",""using"",""wald"",""test""]"
3589,null,null,Correlation between two variables of unequal size,title,"[""correlation"",""two"",""variables"",""unequal"",""size""]"
3592,null,null,"Survival analysis, one cohort, two classifications",title,"[""survival"",""analysis"","","",""one"",""cohort"","","",""two"",""classifications""]"
3595,null,null,Statistics and data mining software tools for dealing with large datasets,title,"[""statistics"",""data"",""mining"",""software"",""tools"",""dealing"",""large"",""datasets""]"
3599,null,null,Model suggestion,title,"[""model"",""suggestion""]"
3614,null,null,How to easily determine the results distribution for multiple dice?,title,"[""easily"",""determine"",""results"",""distribution"",""multiple"",""dice"",""?""]"
3616,null,null,What is the best statistical test for a time series?,title,"[""best"",""statistical"",""test"",""time"",""series"",""?""]"
3623,null,null,Plugging in mean values/proportions to a logistic regression with continuous-discrete interaction,title,"[""plugging"",""mean"",""values/proportions"",""logistic"",""regression"",""continuous-discrete"",""interaction""]"
3630,null,null,CIR Process-Variance reduction,title,"[""cir"",""process-variance"",""reduction""]"
3632,null,null,Should we regress x or use logistic regression on x>5000,title,"[""regress"",""x"",""use"",""logistic"",""regression"",""x"","">"",""5000""]"
3634,null,null,Multi-way nonparametric anova,title,"[""multi-way"",""nonparametric"",""anova""]"
3636,null,null,How to calculate the standard deviation on a sample set with irregular time periods,title,"[""calculate"",""standard"",""deviation"",""sample"",""set"",""irregular"",""time"",""periods""]"
3640,null,null,"How to parameterize the ratio of two normally distributed variables, or the inverse of one?",title,"[""parameterize"",""ratio"",""two"",""normally"",""distributed"",""variables"","","",""inverse"",""one"",""?""]"
3641,null,null,Forecasting Age distribution,title,"[""forecasting"",""age"",""distribution""]"
3646,null,null,Simple Estimates vs Model for calculating mean and variance of population,title,"[""simple"",""estimates"",""vs"",""model"",""calculating"",""mean"",""variance"",""population""]"
3650,null,null,Expected distribution of random draws,title,"[""expected"",""distribution"",""random"",""draws""]"
3653,null,null,Adding coefficients to obtain interaction effects - what to do with SEs?,title,"[""adding"",""coefficients"",""obtain"",""interaction"",""effects"",""-"",""ses"",""?""]"
3672,null,null,A measure to describe the distribution of a dendrogram,title,"[""measure"",""describe"",""distribution"",""dendrogram""]"
3685,null,null,Where to cut a dendrogram?,title,"[""cut"",""dendrogram"",""?""]"
3689,null,null,Coefficient / model averaging to control for exogenous circumstances in prediction,title,"[""coefficient"",""/"",""model"",""averaging"",""control"",""exogenous"",""circumstances"",""prediction""]"
3698,null,null,Understanding published data: z-ratio for proportions,title,"[""understanding"",""published"",""data"","":"",""z-ratio"",""proportions""]"
3702,null,null,Data manipulation in R for functional data analysis,title,"[""data"",""manipulation"",""r"",""functional"",""data"",""analysis""]"
3704,null,null,Adding coefficients to obtain interaction effects - can I add standard errors?,title,"[""adding"",""coefficients"",""obtain"",""interaction"",""effects"",""-"",""add"",""standard"",""errors"",""?""]"
3707,null,null,"Difference between Excel's RAND(), RAND()*RAND(), etc ",title,"[""difference"",""excel"",""'s"",""rand"",""("","")"","","",""rand"",""("","")"",""*"",""rand"",""("","")"","","",""etc""]"
3708,null,null,Forecasting unemployment rate,title,"[""forecasting"",""unemployment"",""rate""]"
3713,null,null,Choosing a clustering method,title,"[""choosing"",""clustering"",""method""]"
3715,null,null,Bayes' Theorem and Agresti-Coull: Will it blend?,title,"[""bayes"",""'"",""theorem"",""agresti-coull"","":"",""blend"",""?""]"
3724,null,null,Microsoft Excel formula for variance,title,"[""microsoft"",""excel"",""formula"",""variance""]"
3730,null,null,Pearson's or Spearman's correlation with non-normal data,title,"[""pearson"",""'s"",""spearman"",""'s"",""correlation"",""non-normal"",""data""]"
3734,null,null,What intuitive explanation is there for the central limit theorem?,title,"[""intuitive"",""explanation"",""central"",""limit"",""theorem"",""?""]"
3739,null,null,Does data transformed in a certain way from a normal distribution fit some other common distribution?,title,"[""data"",""transformed"",""certain"",""way"",""normal"",""distribution"",""fit"",""common"",""distribution"",""?""]"
3746,null,null,Finding the average GPS point,title,"[""finding"",""average"",""gps"",""point""]"
3749,null,null,Usage of HMM in quantitative finance. Examples of HMM that works to detect trend / turning points?,title,"[""usage"",""hmm"",""quantitative"",""finance"",""."",""examples"",""hmm"",""works"",""detect"",""trend"",""/"",""turning"",""points"",""?""]"
3752,null,null,"If variable kernel widths are often good for kernel regression, why are they generally not good for kernel density estimation?",title,"[""variable"",""kernel"",""widths"",""often"",""good"",""kernel"",""regression"","","",""generally"",""good"",""kernel"",""density"",""estimation"",""?""]"
3754,null,null,How to read large dataset in R,title,"[""read"",""large"",""dataset"",""r""]"
3757,null,null,Random effect slopes in linear mixed models,title,"[""random"",""effect"",""slopes"",""linear"",""mixed"",""models""]"
3758,null,null,"""What is a meaning of """"p-value F"""" from Friedman test?""",title,"[""``"",""meaning"",""``"",""''"",""p-value"",""f"",""''"",""''"",""friedman"",""test"",""?"",""''""]"
3759,null,null,Looking for impl of a Fuzzy Neural Network (FNN or SOFNN),title,"[""looking"",""impl"",""fuzzy"",""neural"",""network"",""("",""fnn"",""sofnn"","")""]"
3762,null,null,The best measure of reliability for interval data between 0 and 1,title,"[""best"",""measure"",""reliability"",""interval"",""data"",""0"",""1""]"
3772,null,null,Can I use permutation tests for to avoid the multiple comparison problem in the context of proportions?,title,"[""use"",""permutation"",""tests"",""avoid"",""multiple"",""comparison"",""problem"",""context"",""proportions"",""?""]"
3779,null,null,Probability of not drawing a word from a bag of letters in Scrabble,title,"[""probability"",""drawing"",""word"",""bag"",""letters"",""scrabble""]"
3781,null,null,Is there a way to compute confidence intervals for regression estimates of simulated data?,title,"[""way"",""compute"",""confidence"",""intervals"",""regression"",""estimates"",""simulated"",""data"",""?""]"
3788,null,null,How can the IID assumption be checked in a given dataset?,title,"[""iid"",""assumption"",""checked"",""given"",""dataset"",""?""]"
3793,null,null,Is there a term for generating time-line based data from individual points? Also how would I do this?,title,"[""term"",""generating"",""time-line"",""based"",""data"",""individual"",""points"",""?"",""also"",""would"",""?""]"
3795,null,null,How do you draw structural equation/MPLUS models?,title,"[""draw"",""structural"",""equation/mplus"",""models"",""?""]"
3799,null,null,Probability that someone will like image,title,"[""probability"",""someone"",""like"",""image""]"
3804,null,null,Updating a beta-binomial,title,"[""updating"",""beta-binomial""]"
3805,null,null,Sampling with unequal bins?,title,"[""sampling"",""unequal"",""bins"",""?""]"
3810,null,null,Data transformation for Principal Components Analysis from different Likert scales,title,"[""data"",""transformation"",""principal"",""components"",""analysis"",""different"",""likert"",""scales""]"
3814,null,null,How to annoy a statistical referee?,title,"[""annoy"",""statistical"",""referee"",""?""]"
3818,null,null,Analysis with three categorical variables,title,"[""analysis"",""three"",""categorical"",""variables""]"
3820,null,null,"When does the sd stay the same, even after values in the sample were changed?",title,"[""sd"",""stay"","","",""even"",""values"",""sample"",""changed"",""?""]"
3822,null,null,Inter-rater reliability between similarity matrices,title,"[""inter-rater"",""reliability"",""similarity"",""matrices""]"
3840,null,null,Automatic test measuring dissimilarity between two time series,title,"[""automatic"",""test"",""measuring"",""dissimilarity"",""two"",""time"",""series""]"
3841,null,null,Two years of data describing occurence of violence- testing association with number of patients on ward,title,"[""two"",""years"",""data"",""describing"",""occurence"",""violence-"",""testing"",""association"",""number"",""patients"",""ward""]"
3842,null,null,How to create a barplot diagram where bars are side-by-side in R,title,"[""create"",""barplot"",""diagram"",""bars"",""side-by-side"",""r""]"
3845,null,null,Forecasting unemployment rate with plm,title,"[""forecasting"",""unemployment"",""rate"",""plm""]"
3849,null,null,How can I format and export PCA output in Stata?,title,"[""format"",""export"",""pca"",""output"",""stata"",""?""]"
3853,null,null,How to increase size of label fonts in barplot,title,"[""increase"",""size"",""label"",""fonts"",""barplot""]"
3856,null,null,"""Analyze and generate """"clumpy"""" distributions?""",title,"[""``"",""analyze"",""generate"",""``"",""''"",""clumpy"",""''"",""''"",""distributions"",""?"",""''""]"
3857,null,null,How do I get people to take better care of data?,title,"[""get"",""people"",""take"",""better"",""care"",""data"",""?""]"
3868,null,null,Undefined link function in gamma distribution,title,"[""undefined"",""link"",""function"",""gamma"",""distribution""]"
3872,null,null,Statistical test to compare two ratios from two independent models,title,"[""statistical"",""test"",""compare"",""two"",""ratios"",""two"",""independent"",""models""]"
3874,null,null,Unbalanced mixed effect ANOVA for repeated measures,title,"[""unbalanced"",""mixed"",""effect"",""anova"",""repeated"",""measures""]"
3885,null,null,Computing unbiased estimators of $\sigma$ for m samples of size n,title,"[""computing"",""unbiased"",""estimators"",""$"",""\\sigma"",""$"",""samples"",""size"",""n""]"
3888,null,null,Reorder categorical data in ggplot2,title,"[""reorder"",""categorical"",""data"",""ggplot2""]"
3892,null,null,Why vertical distances?,title,"[""vertical"",""distances"",""?""]"
3894,null,null,Is there a parameter that is calculated as a range to mean ratio?,title,"[""parameter"",""calculated"",""range"",""mean"",""ratio"",""?""]"
3902,null,null,Does corr function in Matlab consider correction for tied ranks?,title,"[""corr"",""function"",""matlab"",""consider"",""correction"",""tied"",""ranks"",""?""]"
3907,null,null,Start time requirements or assumptions for survival analysis,title,"[""start"",""time"",""requirements"",""assumptions"",""survival"",""analysis""]"
3924,null,null,Value based on a supplied standard-deviation,title,"[""value"",""based"",""supplied"",""standard-deviation""]"
3930,null,null,Are there default functions for discrete uniform distributions in R?,title,"[""default"",""functions"",""discrete"",""uniform"",""distributions"",""r"",""?""]"
3931,null,null,Intuitive explanation for dividing by $n-1$ when calculating standard deviation?,title,"[""intuitive"",""explanation"",""dividing"",""$"",""n-1"",""$"",""calculating"",""standard"",""deviation"",""?""]"
3943,null,null,Kendall Tau or Spearman's rho?,title,"[""kendall"",""tau"",""spearman"",""'s"",""rho"",""?""]"
3947,null,null,Help me understand Support Vector Machines,title,"[""help"",""understand"",""support"",""vector"",""machines""]"
3955,null,null,Determining whether a website is active using daily visits,title,"[""determining"",""whether"",""website"",""active"",""using"",""daily"",""visits""]"
3958,null,null,"What is your favorite, easy to use statistical analysis website or software package?",title,"[""favorite"","","",""easy"",""use"",""statistical"",""analysis"",""website"",""software"",""package"",""?""]"
3961,null,null,Random permutation of a vector with a fixed expected sample correlation to the original?,title,"[""random"",""permutation"",""vector"",""fixed"",""expected"",""sample"",""correlation"",""original"",""?""]"
3965,null,null,Overlapping probability distributions,title,"[""overlapping"",""probability"",""distributions""]"
3967,null,null,Sequential hypothesis testing in basic science,title,"[""sequential"",""hypothesis"",""testing"",""basic"",""science""]"
3974,null,null,From Marginal Exp-Norm Distributions to What Conditionals and Joint?,title,"[""marginal"",""exp-norm"",""distributions"",""conditionals"",""joint"",""?""]"
3977,null,null,"""How do you abbreviate """"Millions""""?""",title,"[""``"",""abbreviate"",""``"",""''"",""millions"",""''"",""''"",""?"",""''""]"
3980,null,null,What distribution to use to model changes in ratios?,title,"[""distribution"",""use"",""model"",""changes"",""ratios"",""?""]"
3982,null,null,Adding Zoom & Pan for Protovis Dot Chart with GeoScale,title,"[""adding"",""zoom"",""&"",""pan"",""protovis"",""dot"",""chart"",""geoscale""]"
3989,null,null,How to calculate Rousseeuw’s and Croux’ (1993) Qn scale estimator for large samples?,title,"[""calculate"",""rousseeuw"",""’"",""croux"",""’"",""("",""1993"","")"",""qn"",""scale"",""estimator"",""large"",""samples"",""?""]"
3997,null,null,Subsetting a data-frame in R based on dates,title,"[""subsetting"",""data-frame"",""r"",""based"",""dates""]"
3999,null,null,How to create an index,title,"[""create"",""index""]"
4009,null,null,Inter-rater reliability using Intra-class correlation with ratings for multiple objects on multiple properties,title,"[""inter-rater"",""reliability"",""using"",""intra-class"",""correlation"",""ratings"",""multiple"",""objects"",""multiple"",""properties""]"
4010,null,null,Set a threshold for a sequence,title,"[""set"",""threshold"",""sequence""]"
4013,null,null,Can you say that statistics and probability is like induction and deduction?,title,"[""say"",""statistics"",""probability"",""like"",""induction"",""deduction"",""?""]"
4017,null,null,Translate R to C++ (eventually with Rcpp),title,"[""translate"",""r"",""c++"",""("",""eventually"",""rcpp"","")""]"
4019,null,null,Measuring statistical significance of machine learning algorithms comparison,title,"[""measuring"",""statistical"",""significance"",""machine"",""learning"",""algorithms"",""comparison""]"
4023,null,null,Chi-square test for equality of distributions: how many zeroes does it tolerate?,title,"[""chi-square"",""test"",""equality"",""distributions"","":"",""many"",""zeroes"",""tolerate"",""?""]"
4025,null,null,MLE for Naive Bayes in R,title,"[""mle"",""naive"",""bayes"",""r""]"
4030,null,null,Finding coefficients for VECM + exogenous variables,title,"[""finding"",""coefficients"",""vecm"",""+"",""exogenous"",""variables""]"
4044,null,null,"""Measuring the """"distance"""" between two multivariate distributions""",title,"[""``"",""measuring"",""``"",""''"",""distance"",""''"",""''"",""two"",""multivariate"",""distributions"",""''""]"
4053,null,null,How can the number of connections be Gaussian if it cannot be negative?,title,"[""number"",""connections"",""gaussian"",""negative"",""?""]"
4062,null,null,How to plot a fan (Polar) Dendrogram in R?,title,"[""plot"",""fan"",""("",""polar"","")"",""dendrogram"",""r"",""?""]"
4065,null,null,Random generation of scores similar to those of a classification model,title,"[""random"",""generation"",""scores"",""similar"",""classification"",""model""]"
4068,null,null,How should one define the sample variance for scalar input?,title,"[""one"",""define"",""sample"",""variance"",""scalar"",""input"",""?""]"
4072,null,null,How does one calculate confidence intervals on predictions generated by logit in Stata?,title,"[""one"",""calculate"",""confidence"",""intervals"",""predictions"",""generated"",""logit"",""stata"",""?""]"
4086,null,null,How to make forecasts for a time series?,title,"[""make"",""forecasts"",""time"",""series"",""?""]"
4093,null,null,Interpreting PCA scores,title,"[""interpreting"",""pca"",""scores""]"
4099,null,null,"VIF, condition Index and eigenvalues",title,"[""vif"","","",""condition"",""index"",""eigenvalues""]"
4104,null,null,Data mining algorithm suggestion,title,"[""data"",""mining"",""algorithm"",""suggestion""]"
4111,null,null,"How to estimate how many people attended an event (say, a political rally)?",title,"[""estimate"",""many"",""people"",""attended"",""event"",""("",""say"","","",""political"",""rally"","")"",""?""]"
4120,null,null,Using weighted regression to obtain fit lines for which I only have summary data,title,"[""using"",""weighted"",""regression"",""obtain"",""fit"",""lines"",""summary"",""data""]"
4125,null,null,"Regression Proof that the point of averages (x,y) lies on the estimated regression line",title,"[""regression"",""proof"",""point"",""averages"",""("",""x"","","","")"",""lies"",""estimated"",""regression"",""line""]"
4131,null,null,Comparing model fits across a set of nonlinear regression models,title,"[""comparing"",""model"",""fits"",""across"",""set"",""nonlinear"",""regression"",""models""]"
4138,null,null,What is the probability that random variable $x_1$ is maximum of random vector $X=(x_i)$ from a multivariate normal distribution?,title,"[""probability"",""random"",""variable"",""$"",""x_1"",""$"",""maximum"",""random"",""vector"",""$"",""x="",""("",""x_i"","")"",""$"",""multivariate"",""normal"",""distribution"",""?""]"
