post_id,parent_id,comment_id,text,category,clean_tokens
2151,null,null,How to plot ROC curves in multiclass classification?,title,"[""plot"",""roc"",""curves"",""multiclass"",""classification"",""?""]"
2154,null,null,How to interpret a control chart containing a majority of zero values? (Part 2),title,"[""interpret"",""control"",""chart"",""containing"",""majority"",""zero"",""values"",""?"",""("",""part"",""2"","")""]"
2167,null,null,"""Applying the """"kernel trick"""" to linear methods?""",title,"[""``"",""applying"",""``"",""''"",""kernel"",""trick"",""''"",""''"",""linear"",""methods"",""?"",""''""]"
2169,null,null,How to compute the standard error of an L-estimator?,title,"[""compute"",""standard"",""error"",""l-estimator"",""?""]"
2181,null,null,Book recommendations for multivariate analysis,title,"[""book"",""recommendations"",""multivariate"",""analysis""]"
2190,null,null,How to reconstruct ensemble of trees from random forest?,title,"[""reconstruct"",""ensemble"",""trees"",""random"",""forest"",""?""]"
2213,null,null,What's the difference between feed-forward and recurrent neural networks?,title,"[""'s"",""difference"",""feed-forward"",""recurrent"",""neural"",""networks"",""?""]"
2214,null,null,Estimating parameters of sum-stable RV via L-estimators,title,"[""estimating"",""parameters"",""sum-stable"",""rv"",""via"",""l-estimators""]"
2230,null,null,Convergence in probability vs. almost sure convergence,title,"[""convergence"",""probability"",""vs."",""almost"",""sure"",""convergence""]"
2234,null,null,Alternatives to logistic regression in R,title,"[""alternatives"",""logistic"",""regression"",""r""]"
2245,null,null,Statistics and causal inference?,title,"[""statistics"",""causal"",""inference"",""?""]"
2256,null,null,Adding labels to points using mds and scatter3d package with R,title,"[""adding"",""labels"",""points"",""using"",""mds"",""scatter3d"",""package"",""r""]"
2258,null,null,How to prove that preimage of measurable space is measurable?,title,"[""prove"",""preimage"",""measurable"",""space"",""measurable"",""?""]"
2262,null,null,Area Under Curve (AUC) - given peak mean and standard deviation (SD),title,"[""area"",""curve"",""("",""auc"","")"",""-"",""given"",""peak"",""mean"",""standard"",""deviation"",""("",""sd"","")""]"
2264,null,null,Expected value of small sample,title,"[""expected"",""value"",""small"",""sample""]"
2269,null,null,Access tables created in SAS Enterprise Guide Client into SAS Enterprise Miner Client?,title,"[""access"",""tables"",""created"",""sas"",""enterprise"",""guide"",""client"",""sas"",""enterprise"",""miner"",""client"",""?""]"
2275,null,null,How can I determine accuracy of past probability calculations?,title,"[""determine"",""accuracy"",""past"",""probability"",""calculations"",""?""]"
2282,null,null,Counting how many times a package has been loaded in R?,title,"[""counting"",""many"",""times"",""package"",""loaded"",""r"",""?""]"
2294,null,null,Lumping in Markov process with absorbing states,title,"[""lumping"",""markov"",""process"",""absorbing"",""states""]"
2298,null,null,Visualization of a multivariate function,title,"[""visualization"",""multivariate"",""function""]"
2299,null,null,Statistical forensics: Benford and beyond,title,"[""statistical"",""forensics"","":"",""benford"",""beyond""]"
2306,null,null,"""Feature selection for """"final"""" model when performing cross-validation in machine learning""",title,"[""``"",""feature"",""selection"",""``"",""''"",""final"",""''"",""''"",""model"",""performing"",""cross-validation"",""machine"",""learning"",""''""]"
2326,null,null,Setting up experiment for statistical analysis,title,"[""setting"",""experiment"",""statistical"",""analysis""]"
2328,null,null,How to perform Neural Network modelling effectively?,title,"[""perform"",""neural"",""network"",""modelling"",""effectively"",""?""]"
2335,null,null,Output of logistic model in R,title,"[""output"",""logistic"",""model"",""r""]"
2337,null,null,How to standardize a data-set,title,"[""standardize"",""data-set""]"
2344,null,null,Best way to present a random forest in a publication?,title,"[""best"",""way"",""present"",""random"",""forest"",""publication"",""?""]"
2348,null,null,Metropolis-Hastings algorithms used in practice,title,"[""metropolis-hastings"",""algorithms"",""used"",""practice""]"
2350,null,null,Why does the random forest OOB estimate of error improve when the number of features selected are decreased?,title,"[""random"",""forest"",""oob"",""estimate"",""error"",""improve"",""number"",""features"",""selected"",""decreased"",""?""]"
2352,null,null,When are Shao's results on leave-one-out cross-validation applicable?,title,"[""shao"",""'s"",""results"",""leave-one-out"",""cross-validation"",""applicable"",""?""]"
2356,null,null,Are there any examples where Bayesian credible intervals are obviously inferior to frequentist confidence intervals,title,"[""examples"",""bayesian"",""credible"",""intervals"",""obviously"",""inferior"",""frequentist"",""confidence"",""intervals""]"
2374,null,null,Factor analysis of questionnaires composed of Likert items,title,"[""factor"",""analysis"",""questionnaires"",""composed"",""likert"",""items""]"
2377,null,null,A transform to change skew without affecting kurtosis?,title,"[""transform"",""change"",""skew"",""without"",""affecting"",""kurtosis"",""?""]"
2379,null,null,What are the 'big problems' in statistics?,title,"[""'big"",""problems"",""'"",""statistics"",""?""]"
2385,null,null,Data visualisation- summarise 190 means and response rates,title,"[""data"",""visualisation-"",""summarise"",""190"",""means"",""response"",""rates""]"
2391,null,null,What is the relationship between a chi squared test and test of equal proportions?,title,"[""relationship"",""chi"",""squared"",""test"",""test"",""equal"",""proportions"",""?""]"
2397,null,null,Asymptotic distribution of multinomial,title,"[""asymptotic"",""distribution"",""multinomial""]"
2401,null,null,Is it appropriate to treat n-point Likert scale data as n trials from a binomial process?,title,"[""appropriate"",""treat"",""n-point"",""likert"",""scale"",""data"",""n"",""trials"",""binomial"",""process"",""?""]"
2419,null,null,Boosted decision trees in python?,title,"[""boosted"",""decision"",""trees"",""python"",""?""]"
2420,null,null,Date/Time data on the y-axis,title,"[""date/time"",""data"",""y-axis""]"
2423,null,null,Standard reference for classical mathematical statistics?,title,"[""standard"",""reference"",""classical"",""mathematical"",""statistics"",""?""]"
2427,null,null,"""How should one approch Project Euler problem 213 (""""Flea Circus"""")?""",title,"[""``"",""one"",""approch"",""project"",""euler"",""problem"",""213"",""("",""``"",""''"",""flea"",""circus"",""''"",""''"","")"",""?"",""''""]"
2430,null,null,When does rules based classifier outperforms decision trees?,title,"[""rules"",""based"",""classifier"",""outperforms"",""decision"",""trees"",""?""]"
2432,null,null,LOESS that allows discontinuities,title,"[""loess"",""allows"",""discontinuities""]"
2446,null,null,How to choose df for comparisons between summary statistics (e.g. slope values)?,title,"[""choose"",""df"",""comparisons"",""summary"",""statistics"",""("",""e.g"",""."",""slope"",""values"","")"",""?""]"
2467,null,null,Classification after factor analysis,title,"[""classification"",""factor"",""analysis""]"
2469,null,null,Post hoc tests in ANCOVA,title,"[""post"",""hoc"",""tests"",""ancova""]"
2481,null,null,Asymptotic power,title,"[""asymptotic"",""power""]"
2483,null,null,How to model and test a decision support system (e.g. a terrorist warning system)?,title,"[""model"",""test"",""decision"",""support"",""system"",""("",""e.g"",""."",""terrorist"",""warning"",""system"","")"",""?""]"
2492,null,null,Is normality testing 'essentially useless'?,title,"[""normality"",""testing"",""'essentially"",""useless"",""'"",""?""]"
2493,null,null,Managing error with GPS routes (theoretical framework?),title,"[""managing"",""error"",""gps"",""routes"",""("",""theoretical"",""framework"",""?"","")""]"
2499,null,null,"""What is a """"kernel"""" in plain English?""",title,"[""``"",""``"",""''"",""kernel"",""''"",""''"",""plain"",""english"",""?"",""''""]"
2504,null,null,Test for finite variance?,title,"[""test"",""finite"",""variance"",""?""]"
2510,null,null,Can we approximate this function by a polynomial?,title,"[""approximate"",""function"",""polynomial"",""?""]"
2513,null,null,Pitman's test of equality of variance and testing for regression to the mean: am I doing the right thing?,title,"[""pitman"",""'s"",""test"",""equality"",""variance"",""testing"",""regression"",""mean"","":"",""right"",""thing"",""?""]"
2516,null,null,Are large data sets inappropriate for hypothesis testing?,title,"[""large"",""data"",""sets"",""inappropriate"",""hypothesis"",""testing"",""?""]"
2537,null,null,Confidence intervals on differences in choices in a GEE framework: methods and alternatives?,title,"[""confidence"",""intervals"",""differences"",""choices"",""gee"",""framework"","":"",""methods"",""alternatives"",""?""]"
2541,null,null,What references should be cited to support using 30 as a large enough sample size?,title,"[""references"",""cited"",""support"",""using"",""30"",""large"",""enough"",""sample"",""size"",""?""]"
2547,null,null,Why is median age a better statistic than mean age?,title,"[""median"",""age"",""better"",""statistic"",""mean"",""age"",""?""]"
2563,null,null,What are some of the best ranking algorithms with inputs as up and down votes?,title,"[""best"",""ranking"",""algorithms"",""inputs"",""votes"",""?""]"
2573,null,null,Difference between histogram and pdf?,title,"[""difference"",""histogram"",""pdf"",""?""]"
2580,null,null,Measuring goodness-of-fit in a model that combines two distributions,title,"[""measuring"",""goodness-of-fit"",""model"",""combines"",""two"",""distributions""]"
2585,null,null,Graphing low-end prices of goods in a market over time,title,"[""graphing"",""low-end"",""prices"",""goods"",""market"",""time""]"
2591,null,null,When to use (non)parametric test of homoscedasticity assumption?,title,"[""use"",""("",""non"","")"",""parametric"",""test"",""homoscedasticity"",""assumption"",""?""]"
2597,null,null,What stop-criteria for agglomerative hierarchical clustering are used in practice?,title,"[""stop-criteria"",""agglomerative"",""hierarchical"",""clustering"",""used"",""practice"",""?""]"
2598,null,null,Probability to find the treasure five times in row,title,"[""probability"",""find"",""treasure"",""five"",""times"",""row""]"
2611,null,null,How to combine confidence intervals for a variance component of a mixed-effects model when using multiple imputation,title,"[""combine"",""confidence"",""intervals"",""variance"",""component"",""mixed-effects"",""model"",""using"",""multiple"",""imputation""]"
2613,null,null,How to explain such a big difference between parametric and non parametric test (and other questions)?,title,"[""explain"",""big"",""difference"",""parametric"",""non"",""parametric"",""test"",""("",""questions"","")"",""?""]"
2615,null,null,Analytical solutions to limits of correlation stress testing,title,"[""analytical"",""solutions"",""limits"",""correlation"",""stress"",""testing""]"
2617,null,null,How can I determine the best fit normal distribution from this information?,title,"[""determine"",""best"",""fit"",""normal"",""distribution"",""information"",""?""]"
2619,null,null,Continuous and Categorical variable data analysis,title,"[""continuous"",""categorical"",""variable"",""data"",""analysis""]"
2623,null,null,Autocorrelation in the presence of non-stationarity?,title,"[""autocorrelation"",""presence"",""non-stationarity"",""?""]"
2631,null,null,Can someone explain the C-Index in the context of hierarchical clustering?,title,"[""someone"",""explain"",""c-index"",""context"",""hierarchical"",""clustering"",""?""]"
2635,null,null,Conjugate prior for a Gamma distribution,title,"[""conjugate"",""prior"",""gamma"",""distribution""]"
2639,null,null,How to compare different distributions with reference truth value in Matlab?,title,"[""compare"",""different"",""distributions"",""reference"",""truth"",""value"",""matlab"",""?""]"
2641,null,null,"""What is the difference between """"likelihood"""" and """"probability""""?""",title,"[""``"",""difference"",""``"",""''"",""likelihood"",""''"",""''"",""``"",""''"",""probability"",""''"",""''"",""?"",""''""]"
2648,null,null,Predicting proportions from time with a discontinuity,title,"[""predicting"",""proportions"",""time"",""discontinuity""]"
2650,null,null,Panel data and selection models issue,title,"[""panel"",""data"",""selection"",""models"",""issue""]"
2661,null,null,"""Difference between Norm of Residuals and what is a """"good"""" Norm of Residual""",title,"[""``"",""difference"",""norm"",""residuals"",""``"",""''"",""good"",""''"",""''"",""norm"",""residual"",""''""]"
2667,null,null,All-Purpose Sample Entropy,title,"[""all-purpose"",""sample"",""entropy""]"
2670,null,null,Odds at least 1 person is born in January?,title,"[""odds"",""least"",""1"",""person"",""born"",""january"",""?""]"
2675,null,null,How to calculate average time in service,title,"[""calculate"",""average"",""time"",""service""]"
2686,null,null,Understanding productivity or expenses over time without falling victim to stochastic interruptions,title,"[""understanding"",""productivity"",""expenses"",""time"",""without"",""falling"",""victim"",""stochastic"",""interruptions""]"
2688,null,null,Whether to use robust linear regression or bootstrapping when there is heteroscedasticity?,title,"[""whether"",""use"",""robust"",""linear"",""regression"",""bootstrapping"",""heteroscedasticity"",""?""]"
2691,null,null,"Making sense of principal component analysis, eigenvectors & eigenvalues",title,"[""making"",""sense"",""principal"",""component"",""analysis"","","",""eigenvectors"",""&"",""eigenvalues""]"
2711,null,null,How good is my error?,title,"[""good"",""error"",""?""]"
2717,null,null,Clustering with a distance matrix,title,"[""clustering"",""distance"",""matrix""]"
2728,null,null,Algorithm for choosing the number of clusters when using pam in R?,title,"[""algorithm"",""choosing"",""number"",""clusters"",""using"",""pam"",""r"",""?""]"
2730,null,null,Good resource to understand ANOVA and ANCOVA?,title,"[""good"",""resource"",""understand"",""anova"",""ancova"",""?""]"
2739,null,null,"""What is an """"If-Then"""" rule?""",title,"[""``"",""``"",""''"",""if-then"",""''"",""''"",""rule"",""?"",""''""]"
2742,null,null,On the use of oblique rotation after PCA,title,"[""use"",""oblique"",""rotation"",""pca""]"
2746,null,null,How to efficiently generate random positive-semidefinite correlation matrices?,title,"[""efficiently"",""generate"",""random"",""positive-semidefinite"",""correlation"",""matrices"",""?""]"
2748,null,null,How to conduct conditional Cox regression for matched case-control study?,title,"[""conduct"",""conditional"",""cox"",""regression"",""matched"",""case-control"",""study"",""?""]"
2772,null,null,What is the difference between PCA and asymptotic PCA?,title,"[""difference"",""pca"",""asymptotic"",""pca"",""?""]"
2787,null,null,What's recommended for the number of users to use in qualitative and quantitative usability studies?,title,"[""'s"",""recommended"",""number"",""users"",""use"",""qualitative"",""quantitative"",""usability"",""studies"",""?""]"
2806,null,null,Best PCA algorithm for huge number of features (>10K)?,title,"[""best"",""pca"",""algorithm"",""huge"",""number"",""features"",""("","">"",""10k"","")"",""?""]"
2828,null,null,Measures of model complexity,title,"[""measures"",""model"",""complexity""]"
2844,null,null,What is the difference between summary() and loadings() for princomp() object in R?,title,"[""difference"",""summary"",""("","")"",""loadings"",""("","")"",""princomp"",""("","")"",""object"",""r"",""?""]"
2846,null,null,An easy explanation for the parallel coordinates plot,title,"[""easy"",""explanation"",""parallel"",""coordinates"",""plot""]"
2849,null,null,How to test for causation in a static panel data model with small t?,title,"[""test"",""causation"",""static"",""panel"",""data"",""model"",""small"",""?""]"
2852,null,null,How to analyze these data?,title,"[""analyze"",""data"",""?""]"
2875,null,null,Nearest neighbor information for recommendation engines,title,"[""nearest"",""neighbor"",""information"",""recommendation"",""engines""]"
2891,null,null,Best value to store ratio data and compare it to time period average,title,"[""best"",""value"",""store"",""ratio"",""data"",""compare"",""time"",""period"",""average""]"
2892,null,null,Intuition / interpretation of a distribution of eigenvalues of a correlation matrix?,title,"[""intuition"",""/"",""interpretation"",""distribution"",""eigenvalues"",""correlation"",""matrix"",""?""]"
2893,null,null,Moments of a distribution - any use for partial or higher moments?,title,"[""moments"",""distribution"",""-"",""use"",""partial"",""higher"",""moments"",""?""]"
2894,null,null,Dynamic calculation of number of samples required to estimate the mean,title,"[""dynamic"",""calculation"",""number"",""samples"",""required"",""estimate"",""mean""]"
2904,null,null,"""How can I work around """"lumpiness"""" in simulated maximum likelihood estimation?""",title,"[""``"",""work"",""around"",""``"",""''"",""lumpiness"",""''"",""''"",""simulated"",""maximum"",""likelihood"",""estimation"",""?"",""''""]"
2909,null,null,Computing the cumulative distribution of max drawdown of random walk with drift,title,"[""computing"",""cumulative"",""distribution"",""max"",""drawdown"",""random"",""walk"",""drift""]"
2910,null,null,How to efficiently manage a statistical analysis project?,title,"[""efficiently"",""manage"",""statistical"",""analysis"",""project"",""?""]"
2914,null,null,How to detect when a regression model is over-fit?,title,"[""detect"",""regression"",""model"",""over-fit"",""?""]"
2915,null,null,What is a good internet based source of information on Hierarchical Modeling?,title,"[""good"",""internet"",""based"",""source"",""information"",""hierarchical"",""modeling"",""?""]"
2917,null,null,"Are these formulas for transforming P, LSD, MSD, HSD, CI, to SE as an exact or inflated/conservative estimate of $\hat{\sigma}$ correct?",title,"[""formulas"",""transforming"",""p"","","",""lsd"","","",""msd"","","",""hsd"","","",""ci"","","",""se"",""exact"",""inflated/conservative"",""estimate"",""$"",""\\hat"",""{"",""\\sigma"",""}"",""$"",""correct"",""?""]"
2925,null,null,Is there a verifiable way to generate discrete random variables on the basis of an external event?,title,"[""verifiable"",""way"",""generate"",""discrete"",""random"",""variables"",""basis"",""external"",""event"",""?""]"
2950,null,null,kNN randomization test in R?,title,"[""knn"",""randomization"",""test"",""r"",""?""]"
2958,null,null,How do you calculate the standard deviation on a multiplicative scale for a distribution that has been transformed logarithmically?,title,"[""calculate"",""standard"",""deviation"",""multiplicative"",""scale"",""distribution"",""transformed"",""logarithmically"",""?""]"
2962,null,null,Omega squared for measure of effect in R?,title,"[""omega"",""squared"",""measure"",""effect"",""r"",""?""]"
2971,null,null,"""What is the definition of """"best"""" as used in the term """"best fit"""" and cross validation?""",title,"[""``"",""definition"",""``"",""''"",""best"",""''"",""''"",""used"",""term"",""``"",""''"",""best"",""fit"",""''"",""''"",""cross"",""validation"",""?"",""''""]"
2975,null,null,Normalizing or detrending groups of samples,title,"[""normalizing"",""detrending"",""groups"",""samples""]"
2976,null,null,Clustering variables based on correlations between them,title,"[""clustering"",""variables"",""based"",""correlations""]"
2988,null,null,Sample size calculation for univariate logistic regression,title,"[""sample"",""size"",""calculation"",""univariate"",""logistic"",""regression""]"
3024,null,null,Why is Poisson regression used for count data?,title,"[""poisson"",""regression"",""used"",""count"",""data"",""?""]"
3038,null,null,How to test hypothesis of no group differences?,title,"[""test"",""hypothesis"",""group"",""differences"",""?""]"
3051,null,null,Mean of a sliding window in R,title,"[""mean"",""sliding"",""window"",""r""]"
3052,null,null,How to look for valleys in a graph?,title,"[""look"",""valleys"",""graph"",""?""]"
3061,null,null,Does the concordance correlation coefficient make linearity or monotone assumptions?,title,"[""concordance"",""correlation"",""coefficient"",""make"",""linearity"",""monotone"",""assumptions"",""?""]"
3064,null,null,Longitudinal comparison of two distributions,title,"[""longitudinal"",""comparison"",""two"",""distributions""]"
3069,null,null,"Among Matlab and Python, which language is good for statistical analysis?",title,"[""among"",""matlab"",""python"","","",""language"",""good"",""statistical"",""analysis"",""?""]"
3080,null,null,How to detect which one is the better study when they give you conflicting results?,title,"[""detect"",""one"",""better"",""study"",""give"",""conflicting"",""results"",""?""]"
3082,null,null,"""What is wrong with this """"naive"""" shuffling algorithm?""",title,"[""``"",""wrong"",""``"",""''"",""naive"",""''"",""''"",""shuffling"",""algorithm"",""?"",""''""]"
3086,null,null,Differences between tetrachoric and Pearson correlation,title,"[""differences"",""tetrachoric"",""pearson"",""correlation""]"
3091,null,null,Regression analysis and parameter estimates with populations,title,"[""regression"",""analysis"",""parameter"",""estimates"",""populations""]"
3100,null,null,Quantifying the degree of consistency of two fitted curves,title,"[""quantifying"",""degree"",""consistency"",""two"",""fitted"",""curves""]"
3101,null,null,"""How much can the """"pyramid of evidence"""" be applied to economics and political sciences?""",title,"[""``"",""much"",""``"",""''"",""pyramid"",""evidence"",""''"",""''"",""applied"",""economics"",""political"",""sciences"",""?"",""''""]"
3115,null,null,Cross-correlation significance in R,title,"[""cross-correlation"",""significance"",""r""]"
3119,null,null,How can I adjust classifier to the scale of the other,title,"[""adjust"",""classifier"",""scale""]"
3121,null,null,"Numbers 1-100, calculating how many I must pick to get x% of reliability",title,"[""numbers"",""1-100"","","",""calculating"",""many"",""must"",""pick"",""get"",""x"",""%"",""reliability""]"
3130,null,null,Error in estimating the size of a set?,title,"[""error"",""estimating"",""size"",""set"",""?""]"
3136,null,null,How to perform a test using R to see if data follows normal distribution,title,"[""perform"",""test"",""using"",""r"",""see"",""data"",""follows"",""normal"",""distribution""]"
3140,null,null,Knnclassify() matlab,title,"[""knnclassify"",""("","")"",""matlab""]"
3143,null,null,Linear model with constraints,title,"[""linear"",""model"",""constraints""]"
3156,null,null,Question on confidence interval,title,"[""question"",""confidence"",""interval""]"
3165,null,null,How to calculate cex.axis automatically so to fit to the maximal width possible (in R)?,title,"[""calculate"",""cex.axis"",""automatically"",""fit"",""maximal"",""width"",""possible"",""("",""r"","")"",""?""]"
3171,null,null,Does a high likelihood of duplicate samples invalidate my data or certain operations on it?,title,"[""high"",""likelihood"",""duplicate"",""samples"",""invalidate"",""data"",""certain"",""operations"",""?""]"
3176,null,null,Cross-section and fixed effects models,title,"[""cross-section"",""fixed"",""effects"",""models""]"
3179,null,null,A good way to show lots of data graphically,title,"[""good"",""way"",""show"",""lots"",""data"",""graphically""]"
3180,null,null,Dealing with missing data due to variable not being measured over initial period of a study,title,"[""dealing"",""missing"",""data"",""due"",""variable"",""measured"",""initial"",""period"",""study""]"
3181,null,null,Getting seRious about time series with R,title,"[""getting"",""serious"",""time"",""series"",""r""]"
3194,null,null,How can I test the fairness of a d20?,title,"[""test"",""fairness"",""d20"",""?""]"
3199,null,null,Clustering of a matrix (homogeneity measurement),title,"[""clustering"",""matrix"",""("",""homogeneity"",""measurement"","")""]"
3200,null,null,Is adjusting p-values in a multiple regression for multiple comparisons a good idea?,title,"[""adjusting"",""p-values"",""multiple"",""regression"",""multiple"",""comparisons"",""good"",""idea"",""?""]"
3201,null,null,How do I order or rank a set of experts?,title,"[""order"",""rank"",""set"",""experts"",""?""]"
3212,null,null,"Mode, Class and Type of R objects",title,"[""mode"","","",""class"",""type"",""r"",""objects""]"
3214,null,null,Inter-experimental variation in survival experiment - how to estimate variability?,title,"[""inter-experimental"",""variation"",""survival"",""experiment"",""-"",""estimate"",""variability"",""?""]"
3215,null,null,Trigonometric operations on standard deviations,title,"[""trigonometric"",""operations"",""standard"",""deviations""]"
3235,null,null,Timing functions in R,title,"[""timing"",""functions"",""r""]"
3238,null,null,Time series 'clustering' in R,title,"[""time"",""series"",""'clustering"",""'"",""r""]"
3242,null,null,How to measure/argue the goodness of fit of a trendline to a power law?,title,"[""measure/argue"",""goodness"",""fit"",""trendline"",""power"",""law"",""?""]"
3244,null,null,Do some of you use Google Docs spreadsheet to conduct and share your statistical work with others?,title,"[""use"",""google"",""docs"",""spreadsheet"",""conduct"",""share"",""statistical"",""work"",""others"",""?""]"
3252,null,null,How to cope with exploratory data analysis and data dredging in small-sample studies?,title,"[""cope"",""exploratory"",""data"",""analysis"",""data"",""dredging"",""small-sample"",""studies"",""?""]"
